{
 "anchor": [
  {
   "action": [
    [
     "0",
     "1"
    ],
    [
     "0",
     "1"
    ],
    [
     "0",
     "1"
    ],
    [
     "0",
     "1"
    ],
    [
     "0",
     "1"
    ],
    [
     "0",
     "1"
    ],
    [
     "0",
     "1"
    ],
    [
     "0",
     "1"
    ]
   ],
   "update": [
    [
     [
      [
       "3/4",
       "1/4"
      ],
      [
       "1/4",
       "3/4"
      ]
     ],
     [
      [
       "3/4",
       "1/4"
      ],
      [
       "1/4",
       "3/4"
      ]
     ],
     [
      [
       "3/4",
       "1/4"
      ],
      [
       "1/4",
       "3/4"
      ]
     ],
     [
      [
       "3/4",
       "1/4"
      ],
      [
       "1/4",
       "3/4"
      ]
     ]
    ],
    [
     [
      [
       "3/4",
       "1/4"
      ],
      [
       "1/4",
       "3/4"
      ]
     ],
     [
      [
       "3/4",
       "1/4"
      ],
      [
       "1/4",
       "3/4"
      ]
     ],
     [
      [
       "3/4",
       "1/4"
      ],
      [
       "1/4",
       "3/4"
      ]
     ],
     [
      [
       "3/4",
       "1/4"
      ],
      [
       "1/4",
       "3/4"
      ]
     ]
    ],
    [
     [
      [
       "3/4",
       "1/4"
      ],
      [
       "1/4",
       "3/4"
      ]
     ],
     [
      [
       "3/4",
       "1/4"
      ],
      [
       "1/4",
       "3/4"
      ]
     ],
     [
      [
       "3/4",
       "1/4"
      ],
      [
       "1/4",
       "3/4"
      ]
     ],
     [
      [
       "3/4",
       "1/4"
      ],
      [
       "1/4",
       "3/4"
      ]
     ]
    ],
    [
     [
      [
       "3/4",
       "1/4"
      ],
      [
       "1/4",
       "3/4"
      ]
     ],
     [
      [
       "3/4",
       "1/4"
      ],
      [
       "1/4",
       "3/4"
      ]
     ],
     [
      [
       "3/4",
       "1/4"
      ],
      [
       "1/4",
       "3/4"
      ]
     ],
     [
      [
       "3/4",
       "1/4"
      ],
      [
       "1/4",
       "3/4"
      ]
     ]
    ],
    [
     [
      [
       "3/4",
       "1/4"
      ],
      [
       "1/4",
       "3/4"
      ]
     ],
     [
      [
       "3/4",
       "1/4"
      ],
      [
       "1/4",
       "3/4"
      ]
     ],
     [
      [
       "3/4",
       "1/4"
      ],
      [
       "1/4",
       "3/4"
      ]
     ],
     [
      [
       "3/4",
       "1/4"
      ],
      [
       "1/4",
       "3/4"
      ]
     ]
    ],
    [
     [
      [
       "3/4",
       "1/4"
      ],
      [
       "1/4",
       "3/4"
      ]
     ],
     [
      [
       "3/4",
       "1/4"
      ],
      [
       "1/4",
       "3/4"
      ]
     ],
     [
      [
       "3/4",
       "1/4"
      ],
      [
       "1/4",
       "3/4"
      ]
     ],
     [
      [
       "3/4",
       "1/4"
      ],
      [
       "1/4",
       "3/4"
      ]
     ]
    ],
    [
     [
      [
       "3/4",
       "1/4"
      ],
      [
       "1/4",
       "3/4"
      ]
     ],
     [
      [
       "3/4",
       "1/4"
      ],
      [
       "1/4",
       "3/4"
      ]
     ],
     [
      [
       "3/4",
       "1/4"
      ],
      [
       "1/4",
       "3/4"
      ]
     ],
     [
      [
       "3/4",
       "1/4"
      ],
      [
       "1/4",
       "3/4"
      ]
     ]
    ],
    [
     [
      [
       "3/4",
       "1/4"
      ],
      [
       "1/4",
       "3/4"
      ]
     ],
     [
      [
       "3/4",
       "1/4"
      ],
      [
       "1/4",
       "3/4"
      ]
     ],
     [
      [
       "3/4",
       "1/4"
      ],
      [
       "1/4",
       "3/4"
      ]
     ],
     [
      [
       "3/4",
       "1/4"
      ],
      [
       "1/4",
       "3/4"
      ]
     ]
    ]
   ]
  },
  {
   "action": [
    [
     "0",
     "1"
    ],
    [
     "0",
     "1"
    ],
    [
     "0",
     "1"
    ],
    [
     "0",
     "1"
    ],
    [
     "0",
     "1"
    ],
    [
     "0",
     "1"
    ],
    [
     "0",
     "1"
    ],
    [
     "0",
     "1"
    ]
   ],
   "update": [
    [
     [
      [
       "3/4",
       "1/4"
      ],
      [
       "1/4",
       "3/4"
      ]
     ],
     [
      [
       "3/4",
       "1/4"
      ],
      [
       "1/4",
       "3/4"
      ]
     ],
     [
      [
       "3/4",
       "1/4"
      ],
      [
       "1/4",
       "3/4"
      ]
     ],
     [
      [
       "3/4",
       "1/4"
      ],
      [
       "1/4",
       "3/4"
      ]
     ]
    ],
    [
     [
      [
       "3/4",
       "1/4"
      ],
      [
       "1/4",
       "3/4"
      ]
     ],
     [
      [
       "3/4",
       "1/4"
      ],
      [
       "1/4",
       "3/4"
      ]
     ],
     [
      [
       "3/4",
       "1/4"
      ],
      [
       "1/4",
       "3/4"
      ]
     ],
     [
      [
       "3/4",
       "1/4"
      ],
      [
       "1/4",
       "3/4"
      ]
     ]
    ],
    [
     [
      [
       "3/4",
       "1/4"
      ],
      [
       "1/4",
       "3/4"
      ]
     ],
     [
      [
       "3/4",
       "1/4"
      ],
      [
       "1/4",
       "3/4"
      ]
     ],
     [
      [
       "3/4",
       "1/4"
      ],
      [
       "1/4",
       "3/4"
      ]
     ],
     [
      [
       "3/4",
       "1/4"
      ],
      [
       "1/4",
       "3/4"
      ]
     ]
    ],
    [
     [
      [
       "3/4",
       "1/4"
      ],
      [
       "1/4",
       "3/4"
      ]
     ],
     [
      [
       "3/4",
       "1/4"
      ],
      [
       "1/4",
       "3/4"
      ]
     ],
     [
      [
       "3/4",
       "1/4"
      ],
      [
       "1/4",
       "3/4"
      ]
     ],
     [
      [
       "3/4",
       "1/4"
      ],
      [
       "1/4",
       "3/4"
      ]
     ]
    ],
    [
     [
      [
       "3/4",
       "1/4"
      ],
      [
       "1/4",
       "3/4"
      ]
     ],
     [
      [
       "3/4",
       "1/4"
      ],
      [
       "1/4",
       "3/4"
      ]
     ],
     [
      [
       "3/4",
       "1/4"
      ],
      [
       "1/4",
       "3/4"
      ]
     ],
     [
      [
       "3/4",
       "1/4"
      ],
      [
       "1/4",
       "3/4"
      ]
     ]
    ],
    [
     [
      [
       "3/4",
       "1/4"
      ],
      [
       "1/4",
       "3/4"
      ]
     ],
     [
      [
       "3/4",
       "1/4"
      ],
      [
       "1/4",
       "3/4"
      ]
     ],
     [
      [
       "3/4",
       "1/4"
      ],
      [
       "1/4",
       "3/4"
      ]
     ],
     [
      [
       "3/4",
       "1/4"
      ],
      [
       "1/4",
       "3/4"
      ]
     ]
    ],
    [
     [
      [
       "3/4",
       "1/4"
      ],
      [
       "1/4",
       "3/4"
      ]
     ],
     [
      [
       "3/4",
       "1/4"
      ],
      [
       "1/4",
       "3/4"
      ]
     ],
     [
      [
       "3/4",
       "1/4"
      ],
      [
       "1/4",
       "3/4"
      ]
     ],
     [
      [
       "3/4",
       "1/4"
      ],
      [
       "1/4",
       "3/4"
      ]
     ]
    ],
    [
     [
      [
       "3/4",
       "1/4"
      ],
      [
       "1/4",
       "3/4"
      ]
     ],
     [
      [
       "3/4",
       "1/4"
      ],
      [
       "1/4",
       "3/4"
      ]
     ],
     [
      [
       "3/4",
       "1/4"
      ],
      [
       "1/4",
       "3/4"
      ]
     ],
     [
      [
       "3/4",
       "1/4"
      ],
      [
       "1/4",
       "3/4"
      ]
     ]
    ]
   ]
  }
 ],
 "common_update": [
  [
   [
    [
     "1"
    ],
    [
     "1"
    ]
   ],
   [
    [
     "1"
    ],
    [
     "1"
    ]
   ],
   [
    [
     "1"
    ],
    [
     "1"
    ]
   ],
   [
    [
     "1"
    ],
    [
     "1"
    ]
   ]
  ],
  [
   [
    [
     "1"
    ],
    [
     "1"
    ]
   ],
   [
    [
     "1"
    ],
    [
     "1"
    ]
   ],
   [
    [
     "1"
    ],
    [
     "1"
    ]
   ],
   [
    [
     "1"
    ],
    [
     "1"
    ]
   ]
  ],
  [
   [
    [
     "1"
    ],
    [
     "1"
    ]
   ],
   [
    [
     "1"
    ],
    [
     "1"
    ]
   ],
   [
    [
     "1"
    ],
    [
     "1"
    ]
   ],
   [
    [
     "1"
    ],
    [
     "1"
    ]
   ]
  ],
  [
   [
    [
     "1"
    ],
    [
     "1"
    ]
   ],
   [
    [
     "1"
    ],
    [
     "1"
    ]
   ],
   [
    [
     "1"
    ],
    [
     "1"
    ]
   ],
   [
    [
     "1"
    ],
    [
     "1"
    ]
   ]
  ],
  [
   [
    [
     "1"
    ],
    [
     "1"
    ]
   ],
   [
    [
     "1"
    ],
    [
     "1"
    ]
   ],
   [
    [
     "1"
    ],
    [
     "1"
    ]
   ],
   [
    [
     "1"
    ],
    [
     "1"
    ]
   ]
  ],
  [
   [
    [
     "1"
    ],
    [
     "1"
    ]
   ],
   [
    [
     "1"
    ],
    [
     "1"
    ]
   ],
   [
    [
     "1"
    ],
    [
     "1"
    ]
   ],
   [
    [
     "1"
    ],
    [
     "1"
    ]
   ]
  ],
  [
   [
    [
     "1"
    ],
    [
     "1"
    ]
   ],
   [
    [
     "1"
    ],
    [
     "1"
    ]
   ],
   [
    [
     "1"
    ],
    [
     "1"
    ]
   ],
   [
    [
     "1"
    ],
    [
     "1"
    ]
   ]
  ],
  [
   [
    [
     "1"
    ],
    [
     "1"
    ]
   ],
   [
    [
     "1"
    ],
    [
     "1"
    ]
   ],
   [
    [
     "1"
    ],
    [
     "1"
    ]
   ],
   [
    [
     "1"
    ],
    [
     "1"
    ]
   ]
  ]
 ],
 "format": "Permansson.App.FiniteMultiAgentRequest.v1",
 "labels": {
  "actions": [
   "hold",
   "push"
  ],
  "common": [
   "c"
  ],
  "private": [
   "calm",
   "alert"
  ],
  "world": [
   "ok",
   "bad"
  ]
 },
 "players": [
  {
   "action": [
    [
     "3/4",
     "1/4"
    ],
    [
     "3/4",
     "1/4"
    ],
    [
     "3/4",
     "1/4"
    ],
    [
     "3/4",
     "1/4"
    ],
    [
     "1/4",
     "3/4"
    ],
    [
     "1/4",
     "3/4"
    ],
    [
     "1/4",
     "3/4"
    ],
    [
     "1/4",
     "3/4"
    ]
   ],
   "update": [
    [
     [
      [
       "3/4",
       "1/4"
      ],
      [
       "1/4",
       "3/4"
      ]
     ],
     [
      [
       "3/4",
       "1/4"
      ],
      [
       "1/4",
       "3/4"
      ]
     ],
     [
      [
       "3/4",
       "1/4"
      ],
      [